{
  "$schema": "https://json-schema.org/draft/2020-12/schema",
  "$id": "https://kapso.ai/schemas/agent-plugins/cursor-plugin.schema.json",
  "type": "object",
  "additionalProperties": false,
  "required": ["name"],
  "properties": {
    "name": {
      "type": "string",
      "minLength": 1,
      "pattern": "^[a-z0-9]([a-z0-9.-]*[a-z0-9])?$"
    },
    "displayName": { "type": "string" },
    "description": { "type": "string" },
    "version": { "$ref": "shared-defs.schema.json#/$defs/semver" },
    "author": {
      "type": "object",
      "additionalProperties": false,
      "required": ["name"],
      "properties": {
        "name": { "type": "string", "minLength": 1 },
        "email": { "type": "string", "format": "email" }
      }
    },
    "publisher": { "type": "string", "minLength": 1 },
    "homepage": { "type": "string", "format": "uri" },
    "repository": { "type": "string", "format": "uri" },
    "license": { "type": "string" },
    "logo": { "type": "string" },
    "keywords": {
      "type": "array",
      "items": { "type": "string" }
    },
    "category": { "type": "string" },
    "tags": {
      "type": "array",
      "items": { "type": "string" }
    },
    "commands": { "$ref": "#/$defs/stringOrStringArray" },
    "agents": { "$ref": "#/$defs/stringOrStringArray" },
    "skills": { "$ref": "#/$defs/stringOrStringArray" },
    "rules": { "$ref": "#/$defs/stringOrStringArray" },
    "hooks": {
      "oneOf": [
        { "type": "string" },
        { "type": "object" }
      ]
    },
    "mcpServers": {
      "oneOf": [
        { "type": "string" },
        { "type": "object" },
        {
          "type": "array",
          "items": {
            "oneOf": [
              { "type": "string" },
              { "type": "object" }
            ]
          }
        }
      ]
    }
  },
  "$defs": {
    "stringOrStringArray": {
      "oneOf": [
        { "type": "string" },
        {
          "type": "array",
          "items": { "type": "string" }
        }
      ]
    }
  }
}
