{
  "name": "kapso",
  "displayName": "Kapso",
  "version": "0.1.1",
  "description": "Build, integrate, investigate Findings, search logs, and observe Kapso WhatsApp automations and Project Event workflows with Cursor.",
  "author": {
    "name": "Kapso",
    "email": "dev@kap.so"
  },
  "homepage": "https://kapso.ai",
  "repository": "https://github.com/gokapso/agent-plugins",
  "license": "MIT",
  "logo": "assets/kapso-logo.png",
  "keywords": [
    "kapso",
    "whatsapp",
    "agents",
    "workflows",
    "mcp"
  ],
  "category": "developer-tools",
  "tags": [
    "whatsapp",
    "automation",
    "mcp"
  ],
  "skills": "./skills/",
  "rules": "./rules/",
  "mcpServers": "./mcp.json"
}
